{
  "protocol": "marksheet-extension-fixture@1",
  "registry": ["assertions@1"],
  "source": "assertions_success.ms",
  "expect": {
    "capabilities_complete": true,
    "calculation_complete": true,
    "rendering_complete": true,
    "validation_complete": true,
    "valid": true,
    "diagnostics": [],
    "opaque_instances": ["assertions@1:checks"],
    "instance_outcomes": [{"capability": "assertions@1", "name": "checks", "scope": "sheet:inputs", "outcome": "processed"}]
  }
}
