{
  "protocol": "marksheet-extension-fixture@1",
  "registry": ["vendor_data@1"],
  "source": "opaque_payload_false_terminator.inline",
  "expect": {
    "capabilities_complete": true,
    "calculation_complete": true,
    "rendering_complete": true,
    "validation_complete": true,
    "valid": true,
    "diagnostics": [],
    "opaque_instances": ["vendor_data@1:payload_boundary"],
    "instance_outcomes": [{"capability": "vendor_data@1", "name": "payload_boundary", "scope": "sheet:inputs", "outcome": "processed"}]
  },
  "original_source_base64": "IyFtYXJrc2hlZXQgMC4xCkB1c2UgdmVuZG9yX2RhdGFAMQoKQHNoZWV0IGlucHV0cyAiSW5wdXRzIgpAZXh0ZW5zaW9uIHZlbmRvcl9kYXRhQDEgInBheWxvYWRfYm91bmRhcnkiCmFscGhhDUBlbmQKZ2FtbWENCkBlbmQK",
  "lossless_output_base64": "IyFtYXJrc2hlZXQgMC4xCkB1c2UgdmVuZG9yX2RhdGFAMQoKQHNoZWV0IGlucHV0cyAiSW5wdXRzIgpAZXh0ZW5zaW9uIHZlbmRvcl9kYXRhQDEgInBheWxvYWRfYm91bmRhcnkiCmFscGhhDUBlbmQKZ2FtbWENCkBlbmQK",
  "canonical_output_base64": "IyFtYXJrc2hlZXQgMC4xCkB1c2UgdmVuZG9yX2RhdGFAMQoKQHNoZWV0IGlucHV0cyAiSW5wdXRzIgpAZXh0ZW5zaW9uIHZlbmRvcl9kYXRhQDEgInBheWxvYWRfYm91bmRhcnkiCmFscGhhDUBlbmQKZ2FtbWEKQGVuZAo="
}
