{
  "protocol": "marksheet-extension-fixture@1",
  "registry": ["assertions@1"],
  "source": "assertions_limits.ms",
  "limits": {"max_payload_bytes": 1024, "max_lines": 2, "max_targets": 2, "max_diagnostics": 1},
  "expect": {
    "capabilities_complete": true,
    "calculation_complete": true,
    "rendering_complete": true,
    "validation_complete": false,
    "valid": false,
    "diagnostics": [{"code": "MS3203", "severity": "error", "line": 12}],
    "opaque_instances": ["assertions@1:checks"],
    "instance_outcomes": [{"capability": "assertions@1", "name": "checks", "scope": "sheet:inputs", "outcome": "rejected_by_limit"}]
  }
}
