{
  "protocol": "marksheet-extension-fixture@1",
  "registry": ["assertions@1"],
  "source": "assertions_scope.ms",
  "expect": {
    "capabilities_complete": true,
    "calculation_complete": true,
    "rendering_complete": true,
    "validation_complete": true,
    "valid": true,
    "diagnostics": [],
    "opaque_instances": ["assertions@1:workbook_check", "assertions@1:sheet_check"],
    "instance_outcomes": [
      {"capability": "assertions@1", "name": "workbook_check", "scope": "workbook", "outcome": "processed"},
      {"capability": "assertions@1", "name": "sheet_check", "scope": "sheet:inputs", "outcome": "processed"}
    ]
  }
}
